index,Input,Sentiment,anger,fear,joy,love,sadness,surprise,connotation
9352,i remote which i feel is terrific and great worth,joy,0,0,1,0,0,0,1
13866,i was feeling strong and sassy so i went out back and got the aluminum ladder and carried it up to the house,joy,0,0,1,0,0,0,1
4368,when they changed my office to another room without my agreement,anger,1,0,0,0,0,0,0
433,im really like she said only you can understand the way i feel toni ight she blamed excesses on the merican dream so seldom witnessed never er seen hah hah hah hah hah,sadness,0,0,0,0,1,0,0
9395,im feeling a bit jaded,sadness,0,0,0,0,1,0,0
1678,i want to wake up every morning and feel excited about what s to come,joy,0,0,1,0,0,0,1
8428,i was feeling so indecisive and blah,fear,0,1,0,0,0,0,0
4584,i know that i still feel kind of agitated but i also switch from feeling hot to feeling cold when i lay down,anger,1,0,0,0,0,0,0
491,i feel really pathetic confronted with some,sadness,0,0,0,0,1,0,0
1,im updating my blog because i feel shitty,sadness,0,0,0,0,1,0,0
13720,i have a feeling that i should post some sort of content on here for you blog hoppers to possibly comment about,joy,0,0,1,0,0,0,1
6167,i feel the reader will get confused with because it bounces and uses references from its earliest time period which is like the dawn of time till now,fear,0,1,0,0,0,0,0
7308,i feel she was wronged,anger,1,0,0,0,0,0,0
10528,i feel weird about my self this doesn t feel like me,fear,0,1,0,0,0,0,0
2678,i always think of you as such a violent band violently feeling violent lyrics musically violent,anger,1,0,0,0,0,0,0
3605,i have had some very emotional nights of crying feeling unsure and angry,fear,0,1,0,0,0,0,0
2056,i was feeling like garbage all day allergies but im glad i didnt last minute cancel,joy,0,0,1,0,0,0,1
15224,i feel loyal to the one im with now,love,0,0,0,1,0,0,1
13337,i asked her why she thought of us after having no contact for years she simply said i have been having a feeling to find a little boy for you family and i just know this little guy is perfect for you,joy,0,0,1,0,0,0,1
430,i feel attacked or insulted it is helpful to realize that the idea of attack is alive and well in my own mind,anger,1,0,0,0,0,0,0
6223,i feel that branding in college is way more popular then it was back in high school,joy,0,0,1,0,0,0,1
10946,i feel like it skews the kids idea of what is cute and adorable and just encourages annoying behaviors,joy,0,0,1,0,0,0,1
13225,i feel grumpy to wake up so early,anger,1,0,0,0,0,0,0
965,im just feeling listless and bored or something,sadness,0,0,0,0,1,0,0
8020,i generally don t eat a lot of junk it is mostly stress eating but as i become more comfortable with the child care i am feeling less stressed and eating less junk,anger,1,0,0,0,0,0,0
788,i feel like it s more of a mellow restive dream maker,joy,0,0,1,0,0,0,1
15200,i always conceal my real true feelings because im afraid of being venerable and taking advantage of because well that happened before and it really destroyed me,fear,0,1,0,0,0,0,0
4758,i am feeling so ridiculously uncomfortable these days the rising temperatures dont help and i have added wicked heartburn to the list of things keeping me up at night,fear,0,1,0,0,0,0,0
2226,i feel absolutely safe a,joy,0,0,1,0,0,0,1
9414,i feel it s so obnoxious another vocab word,anger,1,0,0,0,0,0,0
10661,i feel a strange disconnect,fear,0,1,0,0,0,0,0
8711,i should feel all weepy,sadness,0,0,0,0,1,0,0
8507,i have nothing to compare this love to but i feel sure it is a true deep love,joy,0,0,1,0,0,0,1
5721,i feel like i do not have an awful lot of insights to share yet i find it difficult to know where to start,sadness,0,0,0,0,1,0,0
1547,i am writing this on a sunday evening feeling considerably more relaxed well sort of than i did this time last sunday and also at the end of what has been a long stressful but ultimately rewarding week,joy,0,0,1,0,0,0,1
11150,i feel like im not serving a purpose to anyone whether it be keeping them from committing suicide or just a casual conversation partner at a social gathering i am transported to a dark spot,joy,0,0,1,0,0,0,1
169,i begged her to come in the house with me when we got back and she did but left right away feeling distinctly unwelcome,sadness,0,0,0,0,1,0,0
5434,i wake up its the uncomfortable feeling i have that i was just mentally abused by my own thoughts and i can t for the life of me remember why and then when i do remember why i honestly wish i hadn t,sadness,0,0,0,0,1,0,0
1558,i was feeling very bah humbugish coming out of this year s thanksgiving weekend and was not thinking pleasant christmas thoughts about the gift giving guilt trip conspiracy run by the marketing racket the decorating and the whole thing in general,joy,0,0,1,0,0,0,1
7253,i could barely leave the house and i was feeling a lot of isolation and i hated the lack of control i had over my own life because everyone else i knew was moving on with theirs,anger,1,0,0,0,0,0,0
2811,im sure you know the feeling of cant be bothered i just feel poo,anger,1,0,0,0,0,0,0
12274,i got to know more about the three movies i feel sincere respect to the director richard linklater and the whole team of crew of creating this love story,joy,0,0,1,0,0,0,1
8944,i believe we ve decided to catch the bus from there to burgos which again feels like a smart compromise for our feet and bodies,joy,0,0,1,0,0,0,1
10157,i can be surrounded by a sea of people and still feel all alone,sadness,0,0,0,0,1,0,0
684,i feel strongly that by supporting because i am a girl we can have a positive impact on girls both on and off the soccer field said christine sinclair captain canadian women s national team,joy,0,0,1,0,0,0,1
12479,im sure there are plenty of lovely parties going on but im not feeling very sociable whats new,joy,0,0,1,0,0,0,1
12955,i feel blessed to be his sister,joy,0,0,1,0,0,0,1
630,i have made about sex i feel that women enjoy sex when their body and emotions are admired and respected,love,0,0,0,1,0,0,1
365,i really dont think seriously happy and focused like i am familiar with feeling nonetheless rather i feel strangely distracted and uncomfortable,anger,1,0,0,0,0,0,0
3676,i know you cant just ged rid of your feelings but seriously i dont see your parents supporting you dating a guy who s their age,joy,0,0,1,0,0,0,1
144,i am bloging again i am sitting here feeling content with my dogs amp cat etc and i know that how lucky we are the truth is we,joy,0,0,1,0,0,0,1
6507,ive had a long road of that initially feeling like i was being rude for turning down food that was made brought for me and sometimes eating stuff because it was gluten free and looked delicious even if it maybe wasnt what i felt good about eating some really mediocre wedding cake for example,anger,1,0,0,0,0,0,0
638,im feeling indecisive and it scares me,fear,0,1,0,0,0,0,0
6553,i feeling confused with my life and want to know why my life,fear,0,1,0,0,0,0,0
10101,i feel let alone give a shit,sadness,0,0,0,0,1,0,0
9339,i still feel the longing to be with you inspite of you sitting in front of me,love,0,0,0,1,0,0,1
1811,i get the feeling of the idiotic girls i see everyday at school,sadness,0,0,0,0,1,0,0
13668,i feel that way but yeah i do have a problem in trusting especially guys,joy,0,0,1,0,0,0,1
1204,i feel honored to be witness to another s process,joy,0,0,1,0,0,0,1
5405,i feel though its pretty dangerous to to apply one strategy to match,anger,1,0,0,0,0,0,0
9995,i have a desk job and sit on my ass all day long so sometimes i feel paranoid that i m not being active enough and think things like dear god what if i get so fat that i can never lose the baby weight,fear,0,1,0,0,0,0,0
12935,i feel excited to be serving on a team of committed individuals who are dedicated to youth development and environmental education,joy,0,0,1,0,0,0,1
2677,i am feeling irate,anger,1,0,0,0,0,0,0
6097,im feeling lucky button after that you will go to the landing page where you will found the alternative google search engine homepage with colors theme depend on the keywords below,joy,0,0,1,0,0,0,1
14559,i haven t been able to shake this akward and unusual feeling i feel irritable and space out all the time feels like i was surged as well as my computer,anger,1,0,0,0,0,0,0
15970,i have to admit im feeling pretty overwhelmed,surprise,0,0,0,0,0,1,1
1864,i feel unimportant when he spends nights out with sara and i get no phone call,sadness,0,0,0,0,1,0,0
698,i only do unwillingly and always leaves me feeling grouchy and unsettled,anger,1,0,0,0,0,0,0
15971,i feel it would not be loving of me not warn you about the impending social crises facing montana,love,0,0,0,1,0,0,1
6771,i feel so deprived on calories a day,sadness,0,0,0,0,1,0,0
7949,i was okay but thats an awful feeling to be falling with no way to stop it maybe thats why to this day im so afraid of falling,fear,0,1,0,0,0,0,0
5567,i feel like a positive ball of inspiration,joy,0,0,1,0,0,0,1
5976,im not feeling well a href http,joy,0,0,1,0,0,0,1
1362,ive never done a detox or cleanse before and i really had no desire to i feel like cleanses cycle around and become popular every couple of years and id pretty much written them off,joy,0,0,1,0,0,0,1
4374,i often feel the need to defend just about anything even in casual conversation like blue s from the color code are usually christmas fanatics and i jump in and,joy,0,0,1,0,0,0,1
15412,i close my eyes as you hold me close my body feels delicious in your grasp,joy,0,0,1,0,0,0,1
6856,im feeling good but just need a vacation after my vacation,joy,0,0,1,0,0,0,1
87,i am feeling so happy,joy,0,0,1,0,0,0,1
861,i feel assaulted by this shit storm of confusion anger and hurt feelings that tsunami d us both away from each other,fear,0,1,0,0,0,0,0
14595,i have spent the last few weeks feeling sort of uncertain if you will,fear,0,1,0,0,0,0,0
750,ive been coursing through cycles of happiness to a feeling of being mellow to a feeling of being really depressed to being mellow again and then back to the beginning,joy,0,0,1,0,0,0,1
7271,i am feeling very generous amp so i have decided to share with you my readers a free giveaway as a thank you for visiting amp revisiting my page,joy,0,0,1,0,0,0,1
388,im pretty happy but a little on the nauseated side to feel thrilled,joy,0,0,1,0,0,0,1
8228,i don t feel any safe,joy,0,0,1,0,0,0,1
1546,i feel awful that these thoughts are running around in my head but i can t help it,sadness,0,0,0,0,1,0,0
542,i felt even more frustrated and discouraged when i realized my reputation had been damaged but i also realized i had a choice i could feel resentful for the situation i was in or i could rebuild my good reputation,anger,1,0,0,0,0,0,0
3232,i like to listen to it when the weather gets warm though because it makes me feel like i m carefree and at the beach,joy,0,0,1,0,0,0,1
5132,i still feel a bit overwhelmed,fear,0,1,0,0,0,0,0
443,i feel like im more hated than celebrated and i cant wait till the day i can say i made it,anger,1,0,0,0,0,0,0
1925,i feel very privileged not only in being able to share in her artistry but knowing she has my back,joy,0,0,1,0,0,0,1
1392,i feel about them i still end up nervous and have those naughty butterflies flying around my stomach,fear,0,1,0,0,0,0,0
1102,i feel like i look like a miserable heap,sadness,0,0,0,0,1,0,0
15025,i have to admit im not feeling thankful today wh,joy,0,0,1,0,0,0,1
2261,i suck a lot at keeping the house clean and yet feel twitchy when its messy,sadness,0,0,0,0,1,0,0
11495,i will continue to feel disgusted every time i accidentally catch a glimpse of myself in the mirror or see the results of an impromptu picture,anger,1,0,0,0,0,0,0
12794,i especially have trouble socializing with females now before i moved away from my friends and family i actually preferred being with my female friends than with my male friends simply because i did not enjoy feeling like i had to offset my effeminacy and repressed homosexuality,sadness,0,0,0,0,1,0,0
320,i just say that i am not even feeling embarrassed when i pause and rewind my dvred commercials if the breaking dawn preview comes on,sadness,0,0,0,0,1,0,0
232,i was feeling over eager and hopped on to the tube to ride the eye of london,joy,0,0,1,0,0,0,1
3216,im not afraid of going on my own but i feel like a lot of people were in groups and a part of me feels like it would be cool to have a small group to hang out with,joy,0,0,1,0,0,0,1
1548,i feel overwhelmed and humbled but i am alive to keep slugging and i m grateful for the chance,surprise,0,0,0,0,0,1,1
1874,i feel shy about it all and also a little concerned whether my new title will distance me away from people i care for,fear,0,1,0,0,0,0,0
15902,i squeek at the intimate scenes not once did i feel grossed out or appalled in anyway and not because im a freak but because when you read about these two loving people you forget that theyre brother and sister,anger,1,0,0,0,0,0,0
736,i am so sorry for making you feel unimportant lately,sadness,0,0,0,0,1,0,0
7314,i feel terrible for mrs,sadness,0,0,0,0,1,0,0
1542,i feel the vile rising in my throat flipping up the lid on the toilet to let it out,anger,1,0,0,0,0,0,0
6254,i feel it is unfortunate that my companion differs,sadness,0,0,0,0,1,0,0
1855,i felt and still feel really horribly that i scared the poor guy so much that he dropped his tail but im eternally grateful to him for teaching me this fact,fear,0,1,0,0,0,0,0
9020,i dont think i misinterpreted at all helped me feel more assured about the sort of work i had been doing and continued to do,joy,0,0,1,0,0,0,1
12490,i do feel a little confused about my reproductive future do i want another baby deep down,fear,0,1,0,0,0,0,0
12129,i feel pressured to talk to them,fear,0,1,0,0,0,0,0
13772,i feel i need to change that pattern so that i can stand up for myself and learn to be supportive,love,0,0,0,1,0,0,1
15213,i feel very blessed to be given the chance to do what i love,love,0,0,0,1,0,0,1
12429,i was feeling pretty rotten,sadness,0,0,0,0,1,0,0
13453,im hoping to find peace with myself and in the world while still feeling the poetry of the tragic,sadness,0,0,0,0,1,0,0
116,i am actually feeling a little triumphant watching this economic crisis unfold,joy,0,0,1,0,0,0,1
6126,i am feeling really bad for that guy,sadness,0,0,0,0,1,0,0
4326,i feel grouchy now the football fans have woken me up from the customary sunday siesta,anger,1,0,0,0,0,0,0
11788,i really feel deprived,sadness,0,0,0,0,1,0,0
8497,i just hope we can help him feel less afraid and more supported and loved,fear,0,1,0,0,0,0,0
993,i went to a wedding this weekend and i have to say i was feeling very important,joy,0,0,1,0,0,0,1
14731,i know this is love and i feel it there i whisper something so sincere exactly what you want to hear,joy,0,0,1,0,0,0,1
3869,i learned what its truely like to feel and be submissive,sadness,0,0,0,0,1,0,0
1375,i am in no way pessimistic but i often have to bite my tongue in the netherlands when i feel a sarcastic comment popping up in my head,anger,1,0,0,0,0,0,0
8710,i feel so disturbed i have been having difficulties sleeping,sadness,0,0,0,0,1,0,0
4574,i totally passed this one up when it first appeared on xbla but it s now on sony s handheld and it feels like a pretty perfect fit,joy,0,0,1,0,0,0,1
920,i believe a publisher editor should bless his products with as light a hand as is possible and i feel that having my artwork on any of my chapbooks would strike one as being a little self aggrandisement and vain,sadness,0,0,0,0,1,0,0
6314,i feel like it is almost vital that if i do not find more answers about a href http quilting,joy,0,0,1,0,0,0,1
15945,i was already feeling kind of frantic and upset because im spending another year in that god forsaken school,fear,0,1,0,0,0,0,0
4523,i was canning tomatoes and feeling nostalgic,love,0,0,0,1,0,0,1
14588,i need to know that the pain i feel is not in vain and that there is a better and brighter day in my future,sadness,0,0,0,0,1,0,0
162,i am fatter because the only thing in my life that can remain under my control is whether or not i get to eat peanut butter on bread when i get home from an impossible day of to first world looking yet third world feeling hell of needy and neglected little girls,sadness,0,0,0,0,1,0,0
13610,i feel that there s sometimes a danger of companies adding too much free stuff and slitting their own throats,joy,0,0,1,0,0,0,1
15024,i think that however nice these people are they make you feel paranoid that you are doing something wrong,fear,0,1,0,0,0,0,0
1706,i feel we have ignored the talents achievements and skills our our female politicians instead seeking moreso than male politicians to concentrate on their pasts,sadness,0,0,0,0,1,0,0
2270,i really feel that im the least talented person on the stage but somehow god uses my talent for his glory,joy,0,0,1,0,0,0,1
7281,i wake up it hurts knowing that i could have ever possibly done anything to hurt this person to ever make him feel pain or lack of trusting,joy,0,0,1,0,0,0,1
2520,i feel i am really teaching and students get some lovely finished pieces,love,0,0,0,1,0,0,1
6472,i really feel cute when i wear them,joy,0,0,1,0,0,0,1
4553,i know like the recommendation function in modern web shops while it feels a little bit strange to see the product you ve just searched for in a web shop on a totally different site s advertising,fear,0,1,0,0,0,0,0
5242,i feel so empty a href http uwilnevrknow,sadness,0,0,0,0,1,0,0
15160,i wake up this morning i can feel my legs my body is aching,sadness,0,0,0,0,1,0,0
10069,i feel disgusted c kj rel bookmark class permalink nov middot,anger,1,0,0,0,0,0,0
15472,i feel like it was pathetic myself hellip hellip even if any director saw it they wouldn t want me so rather than a drama i want to try a sitcom,sadness,0,0,0,0,1,0,0
7929,i feel a bit frightened that you are touching my car while i am away repeatedly i ask you to stop putting stuff on it,fear,0,1,0,0,0,0,0
637,i feel so blessed to be married to him because he loves his stepchildren,joy,0,0,1,0,0,0,1
941,i feel a bit reluctant to turn to other people,fear,0,1,0,0,0,0,0
735,i feel sad that someone i once knew is leaving as someone i once knew,sadness,0,0,0,0,1,0,0
2243,i feel blessed and privileged to have known you loved you and to know that you are and always will be my child,love,0,0,0,1,0,0,1
10750,i have my drive back and am begging to feel a little bit useful again,joy,0,0,1,0,0,0,1
204,i was starting feel a bit regretful for the break up so i thought id write this list to remind me why i broke it off,sadness,0,0,0,0,1,0,0
14629,i ride because it makes me feel peaceful and alive,joy,0,0,1,0,0,0,1
12448,i realised that this was no longer the truth it was merely the truth i remembered i began to feel disheartened,sadness,0,0,0,0,1,0,0
2948,i have written i feel suddenly hesitant to post it,fear,0,1,0,0,0,0,0
5191,i think came from the weird catholic way we d been raised to feel ashamed about sex,sadness,0,0,0,0,1,0,0
50,i stood up to you i finally stood up to you and now i feel like im being punished if i could go back and do it again,sadness,0,0,0,0,1,0,0
11555,i thought we had done wrong by calling it off and i suddenly didnt feel confident in saying yes,joy,0,0,1,0,0,0,1
1410,i feel too greedy to actually ask them,anger,1,0,0,0,0,0,0
15423,i have struggled with my thyroid waking up each day not feeling well and seeking answers to fix whatever was wrong so i could once again get up and just feel good again,joy,0,0,1,0,0,0,1
10782,i feel ashamed of my lack of empathy at times,sadness,0,0,0,0,1,0,0
1525,i know i haven t met most of you in person but i feel so honored to be able to come together with you as we grow closer to god,joy,0,0,1,0,0,0,1
116,i feel thoroughly virtuous even if the daily trip to the compost bin isn t the most pleasant experience,joy,0,0,1,0,0,0,1
9354,i feel they re going to strengthen the divas division with even more talented female wrestlers and then we re gonna see things shake up more,joy,0,0,1,0,0,0,1
6718,i have grown i m blessed i m proud to say that i am a healthy year old black male with no children and it feels good,joy,0,0,1,0,0,0,1
171,id been feeling a bit funny all day verging on the kind of pre menstrual where you hate yourself so id been trying to take it really easy and just doing my own thing,surprise,0,0,0,0,0,1,1
12600,i started to feel alarmed the voices were so noisy that i actually couldnt listen to my own thoughts,fear,0,1,0,0,0,0,0
1420,i li pouring down in the corner under the moonlight shines on his face i saw his pale face and mouth with half closed eyes bear people feel more distressed,fear,0,1,0,0,0,0,0
1143,i found out i was pregnant which is alot but it makes me feel a little less scared knowing that my doctor is watching everything and were taking things day by day,fear,0,1,0,0,0,0,0
11985,i dnt want yu guys t feel shamed fr knwing nthing instead f pretending r having plastikan with me,sadness,0,0,0,0,1,0,0
1980,i wrote feel there rather than think or believe because i know objectively that i am smart probably smarter than most people but most of the time im more conscious of what i dont know than what i do know,joy,0,0,1,0,0,0,1
2300,i feel very agitated and sort of lost,anger,1,0,0,0,0,0,0
5739,i shouldn t feel so apprehensive,fear,0,1,0,0,0,0,0
13541,i know is my feelings were innocent,joy,0,0,1,0,0,0,1
276,i am so festive this feels so delicious wheeeeee what a great night,joy,0,0,1,0,0,0,1
154,i often feel offended when people other fans think i name my son joshua as joshua in josh groban,anger,1,0,0,0,0,0,0
9536,i was expecting to say this is a very bittersweet feeling but all im feeling is bitter,anger,1,0,0,0,0,0,0
4709,ive never thought i would feel so guilty for trying to protect someones feelings,sadness,0,0,0,0,1,0,0
32,i have found in the past when i blog daily i have more to say and i get out my feelings and emotions in more creative ways,joy,0,0,1,0,0,0,1
191,i could feel the muscles in my arches ankles and calves working to support my stride and i felt so much more graceful,joy,0,0,1,0,0,0,1
3122,i forget that any time we have a disagreement or she feels like she s been wronged in some way that every bad thing i ve ever done in my life every poor choice every single thing that she doesn t agree with comes back screaming in my face,anger,1,0,0,0,0,0,0
1697,i don t have to stiffen don t have to fight for myself or feel bad about behaving the way i naturally behave,sadness,0,0,0,0,1,0,0
1205,i got home and told peter how i was feeling he wasnt shocked at all by what i was telling him,surprise,0,0,0,0,0,1,1
5723,i would feel drained after my workouts but that to be expected after any workout at least in my experience,sadness,0,0,0,0,1,0,0
1234,i guess you cant see how wed feel a bit unwelcome,sadness,0,0,0,0,1,0,0
14962,i go to pt i feel like a defective bum,sadness,0,0,0,0,1,0,0
573,i feel so bad about it and hes stood there bewildered,sadness,0,0,0,0,1,0,0
14022,i feel so disheartened that i feel nauseous and sick,sadness,0,0,0,0,1,0,0
1221,i can say is that despite my occasional jokes to the contrary i feel its vital the modern reader understand that not every german was a devout nazi and many in fact detested the partys ideology especially academics and those who were forcibly conscripted into service like gunther and company,joy,0,0,1,0,0,0,1
7582,i was so stubborn and that it took you getting hurt for me to admit even to myself how i feel i haven t been very considerate of you in that respect,love,0,0,0,1,0,0,1
14042,i had to get up soon for choir so i dealt with the feeling of a headache thats not killer but could get that way if you angered it for most of the evening,anger,1,0,0,0,0,0,0
15727,i wanted to avoid feeling rushed,anger,1,0,0,0,0,0,0
4049,i would also hate for you to feel i was selfish in my decision,anger,1,0,0,0,0,0,0
2234,i was overwhelmed by the feeling of being impressed i think these kids theyre years younger than me i can call them kids right,surprise,0,0,0,0,0,1,1
709,i feel embarrassed enough,sadness,0,0,0,0,1,0,0
15860,i was so busy analysing what s wrong that i end up feeling bitter with the things that makes me happy before,anger,1,0,0,0,0,0,0
4940,when i heard about the way a parent of a friend had mistreated him,anger,1,0,0,0,0,0,0
465,im not only thankful that everything seems to be working out as i wrap week at my new job but also feeling pretty lucky to have the people we do in our lives,joy,0,0,1,0,0,0,1
174,i feel embarrassed that it got so bad,sadness,0,0,0,0,1,0,0
12904,i just feel like i was foolish ignoring warnings about cell phones,sadness,0,0,0,0,1,0,0
729,i know what it feels like to face irate customers,anger,1,0,0,0,0,0,0
13596,i feel so disheartened at things,sadness,0,0,0,0,1,0,0
77,i think feelings are one of nay the most important things we have,joy,0,0,1,0,0,0,1
6609,i don t see december as the month of happiness counting down the days until christmas this doesn t feel like the season to be jolly anymore,joy,0,0,1,0,0,0,1
8362,i must say that im not feeling gloomy at all about this place,sadness,0,0,0,0,1,0,0
1683,i blamed the people around me for making me feel less valued for being a stay at home mom,joy,0,0,1,0,0,0,1
9243,i hope she didnt get that feeling i didnt want to make her feel bad about bringing it up,sadness,0,0,0,0,1,0,0
512,i am alternating between feeling thrilled to see my dads family this weekend and terrified that i will be a black sheep among their normalcy,joy,0,0,1,0,0,0,1
1701,i feel affectionate toward him,love,0,0,0,1,0,0,1
1389,i feel safe around you and i never wanna lose you or let you go ever,joy,0,0,1,0,0,0,1
639,ive been feeling so restless lately why i bleached my hair so much a month ago,fear,0,1,0,0,0,0,0
470,im feeling like life is fairly sweet,love,0,0,0,1,0,0,1
14671,i feel like i should go for a run to expend all this idiotic energy but iv decided to do some homework now instead and store the energy for a social event im going to this evening,sadness,0,0,0,0,1,0,0
