index,Input,Sentiment,anger,fear,joy,love,sadness,surprise,connotation
1201,i feel like my efforts are all in vain and continuing to pursue them will only embarrass me down the road,sadness,0,0,0,0,1,0,0
15811,i feel ashamed that my two bags look like theyve erupted exploded natural disastered all over my hosts spotless stylish living room,sadness,0,0,0,0,1,0,0
13724,i counsel people who are in abusive relationships i have prided myself with understanding how they feel being a supportive resource because i get it,love,0,0,0,1,0,0,1
5267,i am feeling really confident moving into tomorrow as it will be the same juice smoothie and raw vegan meal menu routine,joy,0,0,1,0,0,0,1
5086,i feel terrible but i can t even remember all the girls that came to pray with me last night,sadness,0,0,0,0,1,0,0
865,i don t know how i feel about my submissive learning how to use a firearm,sadness,0,0,0,0,1,0,0
69,i was feeling brave when i bought it and clearly when i was doing my makeup,joy,0,0,1,0,0,0,1
8510,i feel like the addition of sweet fresh corn really adds a touch of summer to an otherwise heavy fall dish,joy,0,0,1,0,0,0,1
521,i feel as if this opportunity to return to moz is gods gracious gracious way of giving me that heat desire despite my own self doubt and uncertainty in the past,joy,0,0,1,0,0,0,1
14909,i feel that core of the song the melody should be respected as well as the lyrics but the rest can be should be changed,joy,0,0,1,0,0,0,1
756,i feel that way considering most people are pretending to be the way they are and very very few are being sincere,joy,0,0,1,0,0,0,1
11100,im particularly feeling pressured to act and behave in ways that are culturally accepted and expected of me,fear,0,1,0,0,0,0,0
884,i cant give you an exact reason but the book left me feeling discouraged while the movie is uplifting,sadness,0,0,0,0,1,0,0
1704,i landed at the reagan airport feeling pretty good,joy,0,0,1,0,0,0,1
12656,i feel violent and crazy and i feel myself slowly losing patience,anger,1,0,0,0,0,0,0
13064,im supposed to feel sympathetic to a child killer,love,0,0,0,1,0,0,1
299,im feeling slightly irritable today,anger,1,0,0,0,0,0,0
10248,i devote this blog to her and pray with her for peace in the world especially when we feel frightened by religious violence,fear,0,1,0,0,0,0,0
5102,i feel so disheartened now,sadness,0,0,0,0,1,0,0
11331,i really feel like is mostly the culmination of starting to play more clubs and wanting to make more dancefloor friendly stuff and having stuff that has a certain tempo range that fits nicely in that setting,joy,0,0,1,0,0,0,1
9008,i cannot help but feel that my life is a series of not so unpleasant accidents stumbling about trying to do the right thing,sadness,0,0,0,0,1,0,0
2418,i feel very blessed this year my daughter and her family will be with us and my sister from california is coming over this year too,love,0,0,0,1,0,0,1
8655,i do not believe guns are the solution to feeling afraid,fear,0,1,0,0,0,0,0
750,i was laughing at my husband because he was still feeling skeptical with me cooking nice gozelemes,fear,0,1,0,0,0,0,0
8472,i hope my generation will pass on good values and beliefs to the next generation because i feel that is very important,joy,0,0,1,0,0,0,1
1943,i think that in this way though the readers will most likely agree with what i wrote and hopefully feel more passionate about scientific research,love,0,0,0,1,0,0,1
692,i cant believe this is right but i feel a lot less alarmed since the sea is still at a steady,fear,0,1,0,0,0,0,0
7455,im feeling optimistic about this third year confident for the first time in my abilities as a business owner and teacher,joy,0,0,1,0,0,0,1
1251,i was feeling pretty wiped out mentally amp physically i was determined to get some oxygen to my brain,joy,0,0,1,0,0,0,1
8699,i try to hold my tongue try to see it from his point of view but inside i am feeling agitated and irritable about all this pressure to please him when i cannot seem to get my own self in order,fear,0,1,0,0,0,0,0
9709,i made this i felt some relief from the fear and anxiety but i started feeling pissed again with a whole new set of memories,anger,1,0,0,0,0,0,0
3978,i do however feel that some people would not be so shocked right,surprise,0,0,0,0,0,1,1
382,i love and feel passionate about i m living my dream and now that i ve gotten a taste of what that feels like nothing can stop me,love,0,0,0,1,0,0,1
986,i surround myself with bible verses that help me to transcend to a space where i feel safe and secure,joy,0,0,1,0,0,0,1
5151,im feeling particularly sentimental or what have you i go into a bookstore where my books are sold and i pace out the distance between where my books are displayed and where his are on the shelf,sadness,0,0,0,0,1,0,0
8512,i almost always feel fantastic after i exercise so i recommend doing it every day if you can,joy,0,0,1,0,0,0,1
2363,i mention this one doesn t feel fake,sadness,0,0,0,0,1,0,0
7789,i feel pained just thinking about it,sadness,0,0,0,0,1,0,0
11427,i am going on day of my goddess workouts and am feeling fabulous,joy,0,0,1,0,0,0,1
4977,i could continue feeling awful and crying to all my friends and focus on how wronged i had been and end up feeling worse,sadness,0,0,0,0,1,0,0
1595,i might do so simply because i couldnt keep my mouth shut makes me feel terrible,sadness,0,0,0,0,1,0,0
8611,i had a feeling you werent very fond of her,love,0,0,0,1,0,0,1
1800,i was feeling rejected and sad,sadness,0,0,0,0,1,0,0
718,im feeling more generous its intelligent background music that sounds much better in a large living room than in the confined space of the car or worse still on your walkman,joy,0,0,1,0,0,0,1
7248,i feel tortured by my self inducing deprecation and resentment,fear,0,1,0,0,0,0,0
5910,i wave remember how many people love you and feel our arms supporting you under the deep and painful sea,joy,0,0,1,0,0,0,1
519,i didn t really go looking for it but i can definately see where the enjorlas marius ship comes from though sadly i feel it s mostly one sided and that marius is nothing more than a rich schoolboy following his whims without thoughts to the concequences,joy,0,0,1,0,0,0,1
5339,i just feel so unsure of myself and everything in my life,fear,0,1,0,0,0,0,0
1195,i remain hopeful that the feeling i have is actually excitement a long missed friend,sadness,0,0,0,0,1,0,0
13092,i hope you feel a little more glamorous after reading todays pinterest loves,joy,0,0,1,0,0,0,1
13660,i feel like i ve been there and gained a sense of the everyday paranoia and the casual brutality of the time,joy,0,0,1,0,0,0,1
1844,i must add the crowd was similar to last night except it had a much more laid back stoner feel with supporting cast of parents escaped from their kids,love,0,0,0,1,0,0,1
898,i have been praying everyday about it and i just feel more and more convinced that this is what god has called me to so we will see,joy,0,0,1,0,0,0,1
15333,im feeling emotionally vulnerable right now and just want to throw up in peace so i can go back up and party hard,fear,0,1,0,0,0,0,0
15451,i cant help but feel that youll just break me again and that you might not be as faithful as you seem,love,0,0,0,1,0,0,1
13031,i was not aware of his point of view as a white european who had undertaken this trip as a fulfillment of a childhood dream but maybe because of this awareness i was able to feel the tragic dawning marlowe experiences of humanitys ruthless rapacity and greed,sadness,0,0,0,0,1,0,0
351,i always want nemo by my side and sleeping without her now feels weird even though it doesnt happen often that i get to,surprise,0,0,0,0,0,1,1
2635,i got really fucked up last night i got really really really fucked up on loads of downers it was such a bad idea such a bad idea i feel like a neurotic mess right now i cant handle it i cant handle it i cant handle it,fear,0,1,0,0,0,0,0
4248,i never feel like i have it perfect sometimes i lean a little too heavy on the work which means more chaos at home and sometimes i lean a little too heavy on the home which means i get a little lonely and cranky,joy,0,0,1,0,0,0,1
4835,i think i m feeling dissatisfied with my life,anger,1,0,0,0,0,0,0
13740,i should be dead since ive been out of this for a couple of months but i feel the pain every time i go to reach for that empty bottle i just cannot bear to throw out,sadness,0,0,0,0,1,0,0
8368,i have been feeling for quite a while that i am just not satisfied with my stash when it comes to blushes,joy,0,0,1,0,0,0,1
6932,i feel so so tortured by looking at the lecture notes and nothing is going in except for my holiday plans,anger,1,0,0,0,0,0,0
281,im feeling a bit needy i keep thinking i would appreciate any attention but of course that is not true,sadness,0,0,0,0,1,0,0
1802,i feel remorseful for the crimes that were committed intentionally or unintentionally and whether or not i had known about it or not known about it,sadness,0,0,0,0,1,0,0
1486,i feel as though my descriptions are skimmable and unimportant,sadness,0,0,0,0,1,0,0
1533,i feel abit hopeless at times man darn itttt,sadness,0,0,0,0,1,0,0
11478,i feel like a neglectful pet owner,sadness,0,0,0,0,1,0,0
13287,i feel nostalgic a lot more than i felt after passing out of the school,love,0,0,0,1,0,0,1
14741,i actually feel frightened of people here right now,fear,0,1,0,0,0,0,0
1764,i don t know how else to describe it except to say that i had the same feeling about three weeks before my beloved grandmother passed away,joy,0,0,1,0,0,0,1
11328,i can feel the longing and care and love too,love,0,0,0,1,0,0,1
13963,i feel that i ll be doomed to long pants and ugly shoes for the rest of my life and i m not even yet,sadness,0,0,0,0,1,0,0
13266,i think the biggest problem is that rather than turning something like this off people feel the need to become victimized by something that has nothing to do with them and blog about it in nd rate publications and that is being generous,sadness,0,0,0,0,1,0,0
10325,i always feel this tangle in my stomach i never just feel content and wanted,joy,0,0,1,0,0,0,1
13421,i am quick to anger and lash out yet even quicker feel remorseful almost immediately,sadness,0,0,0,0,1,0,0
5479,i lose friends because they apparently dont like that i tell people how i feel its funny how that works,surprise,0,0,0,0,0,1,1
11428,i feel i am with ampatuan and joining the forces of hell bitchy human who only wants is to spread their worst odor in this world,anger,1,0,0,0,0,0,0
2671,i feel so numb and so asleep yet every single feeling is so sharp and so full of pain,sadness,0,0,0,0,1,0,0
15414,i feel the depths of sorrow and suffering in love because i have felt its heights of joy and goodness,sadness,0,0,0,0,1,0,0
4000,i remember just knowing you were crazy in love with me without a shadow of a doubt and you made me feel gorgeous always,joy,0,0,1,0,0,0,1
9259,i tuck the fear back into a quiet chamber of my heart to ponder it for another day when i am feeling less brave,joy,0,0,1,0,0,0,1
6939,i feel determined to do well for my mother tongue paper that will be here in odd days time,joy,0,0,1,0,0,0,1
12597,i love to sew cook and also dabble in mixed media art when i feel like getting messy,sadness,0,0,0,0,1,0,0
9200,i feel really lucky that i m making a living doing this and i think it s important to pass the word about tap dance,joy,0,0,1,0,0,0,1
9805,i do not see but could feel that she is someone i am very reluctant to let go,fear,0,1,0,0,0,0,0
7716,i feel more shitty and emotional and helpless,sadness,0,0,0,0,1,0,0
580,i just feel very cheated and quite frightened that i was invaded like this,fear,0,1,0,0,0,0,0
15809,i feel like such a lame person but sigh i just don t know what to do i m so damn shy,sadness,0,0,0,0,1,0,0
780,i have lost lbs have never been sick got off blood pressure and cholesterol meds and i feel terrific,joy,0,0,1,0,0,0,1
8754,i just have a feeling there s something special in his simplicity something that i m not yet able to put my finger on,joy,0,0,1,0,0,0,1
15460,i feel a dull aching a sharp pain in my chest an overwhelming emptiness,sadness,0,0,0,0,1,0,0
14466,i should stop feeling so lousy about myself,sadness,0,0,0,0,1,0,0
25,i waited for an eternity for it to download and now im remembering a day when i had to wait to go to walmart to buy a whole cd just to hear one song and feeling kinda dumb with my impatience,sadness,0,0,0,0,1,0,0
5395,i feel those feelings coming back all those hateful jealous paranoid feelings that used to torture me relentlessly,anger,1,0,0,0,0,0,0
5437,i feel numb jun nd,sadness,0,0,0,0,1,0,0
15769,i feel like i hated them when we argue,sadness,0,0,0,0,1,0,0
4180,im feeling a bit weepy today,sadness,0,0,0,0,1,0,0
439,i always feel a bit awkward when i comment on someone s blog because i invariably go on rabbit trails and feel as though i ve been overstepping myself so i d like to tell you if you find yourself feeling the same way that i do not mind in the slightest,sadness,0,0,0,0,1,0,0
1297,i think she just rolled out i guess she s over it already i m kinda feeling that but no one has performed yet and word on the street is there is supposed to be a surprised performance by lil wayne nikki minaj and drake that would be dope,surprise,0,0,0,0,0,1,1
12752,i feel so honored that they enjoy it enough to create with it,joy,0,0,1,0,0,0,1
7583,i have never really had luck with them so im feeling a bit jaded,sadness,0,0,0,0,1,0,0
896,i just feel so smug that we got the exploited and she gets bruno marzzz,joy,0,0,1,0,0,0,1
15255,i had a quarrel with my father,anger,1,0,0,0,0,0,0
12119,i said those who feel unhappy with the way uhuru has been running his government should wait for the elections,sadness,0,0,0,0,1,0,0
13130,i feel like a child with a most delicious treat while drinking it,joy,0,0,1,0,0,0,1
1249,i feel so welcomed,joy,0,0,1,0,0,0,1
8635,i couldnt help but feel that all these people had missed the best of the day,sadness,0,0,0,0,1,0,0
12499,i dont like the way i feel when i am angry,anger,1,0,0,0,0,0,0
15077,i decide to take ill still feel ive resolved a win win situation,joy,0,0,1,0,0,0,1
10121,i can sink into the stillness to feel the gentle hum of that light there is pleasure in contrast,love,0,0,0,1,0,0,1
290,i just feel are ludicrous and wasting space or so trite they should have looked at the book first and come up with something a little more original,surprise,0,0,0,0,0,1,1
1263,i feel so incredibly graceful and sexy in this pose i have to say,joy,0,0,1,0,0,0,1
75,i feel disgusted in any man in power who talks about electricity being a problem in his area and says even my own house has similar problems,anger,1,0,0,0,0,0,0
9787,i know its been awhile since i posted but between feeling crappy all the time work and just being plain lazy i havent even gotten on the computer,sadness,0,0,0,0,1,0,0
13344,before an exam which i,fear,0,1,0,0,0,0,0
8773,i don t know but it seems important to them that i feel unwelcome,sadness,0,0,0,0,1,0,0
47,i feel like i had a rather productive weekend and i cant always say that no matter how much i get done,joy,0,0,1,0,0,0,1
10903,i left feeling too dull to come up with ideas,sadness,0,0,0,0,1,0,0
2340,im feeling shy im feeling mad im feeling sad,fear,0,1,0,0,0,0,0
988,i feel a little less gloomy a little more optimistic or a little better prepared to face what life throws my way,sadness,0,0,0,0,1,0,0
8121,i feel this is just another clever ploy played by ashraf to attempt to avoid a beating at the hands of pakistani fans,joy,0,0,1,0,0,0,1
8761,i fall off when my uncle hits so i cant imagine what it must feel like to go mph other than cool and possibly painful,joy,0,0,1,0,0,0,1
10203,i can then sit seeing a random picture of colored christmas lights and feel my heart hurt from missing him so much,sadness,0,0,0,0,1,0,0
636,i feel awards are for people who are enormously talented,joy,0,0,1,0,0,0,1
751,i was feeling a little more resentful of what appeared to be poor planning by the organizers,anger,1,0,0,0,0,0,0
1932,i was feeling a bit jaded that day but told myself why the hell not,sadness,0,0,0,0,1,0,0
9648,i was actual acceptable at compassionate others but i still didnt feel accepted by them,love,0,0,0,1,0,0,1
13499,i feel im simply doomed to repeat the cycle of obesity over and over again,sadness,0,0,0,0,1,0,0
1864,i do feel productive anyway,joy,0,0,1,0,0,0,1
8144,i feel guilty leaving an f,sadness,0,0,0,0,1,0,0
11605,i feel more mellow about this move than k is,joy,0,0,1,0,0,0,1
136,i clench to the corners of the bed to feel assured,joy,0,0,1,0,0,0,1
10236,i feel kind of reluctant and depressed when you told me that it s over i respected your decision,fear,0,1,0,0,0,0,0
13176,im feeling adventurous today getting excited about my upcoming vacation so i thought why not dress for my mood,joy,0,0,1,0,0,0,1
8808,i should run i should always run but i controlled myself pretty well at dinner and did not even feel guilty,sadness,0,0,0,0,1,0,0
7355,i feel satisfied and pleased after getting good marks in exams or praise from teachers for good performance,joy,0,0,1,0,0,0,1
5078,i feel guilty that i dont have the need to constantly check in on her,sadness,0,0,0,0,1,0,0
7714,i still have a way to go but i am so much closer to the finish line than the start line and that feels amazing,joy,0,0,1,0,0,0,1
736,i feel privileged to have narrated erik princes autobiography civilian warriors the inside story of blackwater and the unsung heroes of the war on terror which will be released this monday nov th,joy,0,0,1,0,0,0,1
1796,i don t care if any of you read this but this is just what i feel when i m around you guys i feel hated,sadness,0,0,0,0,1,0,0
1157,i was feeling superior to women who left their alcoholic husbands i was stronger and more godly and wasnt ever going to do that,joy,0,0,1,0,0,0,1
15220,im feeling about as horny as a dead goat,love,0,0,0,1,0,0,1
1277,i believe that with our minds focused on the daily rat race our bodies simply forget how to feel vital and free a classic case of you lose what you dont use,joy,0,0,1,0,0,0,1
11887,i feel horrible and i would prefer to extend my deepest sorrow rel bookmark permanenter link zum eintrag,sadness,0,0,0,0,1,0,0
2851,i feel drained and depressed by it all,sadness,0,0,0,0,1,0,0
12524,i feel loyal to him in some ways so respect his wish not to tell anyone but it is killing me keeping it inside,love,0,0,0,1,0,0,1
7644,i visited finland a couple of weeks ago and albeit it was wonderful and extremely refreshing to be back in my hometown for the first time in four weeks after spending only a few days there i begun to feel slightly homesick homesick for tallinn,sadness,0,0,0,0,1,0,0
7791,i feel like i liked it but at the same time i feel let down,love,0,0,0,1,0,0,1
784,i turn up feeling more than a little apprehensive,fear,0,1,0,0,0,0,0
8124,i feel like im gonna be so greedy with him cuz i just love him so much,anger,1,0,0,0,0,0,0
2473,i wasnt feeling particularly bitter on my birthday in fact i had a fantastic day,anger,1,0,0,0,0,0,0
15599,i feel triumphant and such,joy,0,0,1,0,0,0,1
7775,i feel lame even saying it,sadness,0,0,0,0,1,0,0
1676,i am again not inspired and after looking at ideas and images i feel that i dont appreciate them anymore they become useless and purely skill driven having nothing to do with thought,sadness,0,0,0,0,1,0,0
7940,i went over my feelings she said i am very fearful and conflicted,fear,0,1,0,0,0,0,0
3844,i imagine how would it feel to hold you nothing perverse just to know you to feel the heat of your breathe moving through me your feet tangled with mine,sadness,0,0,0,0,1,0,0
12057,i told him it was a good drink and made him feel talented as a bartender,joy,0,0,1,0,0,0,1
3858,im getting there but i really do feel dazed and confused at the moment,surprise,0,0,0,0,0,1,1
5983,i get that its easiest for them to jolt people into submission with electricity but i get the feeling that its becoming a more socially acceptable version of beating someone with a billy club,joy,0,0,1,0,0,0,1
12459,i enjoy reading immensely and i feel strange or off when i m in between books or just lack the time to read,surprise,0,0,0,0,0,1,1
2839,i like feeling submissive or at the very least that my lover is dominant,sadness,0,0,0,0,1,0,0
1053,i feel furious with myself,anger,1,0,0,0,0,0,0
752,i probably couldn t go back to washington permanently once the baby is here at least not for a while although i have been torn for a while about whether i want to yes bleu i know how you feel about this but i m still not completely convinced,joy,0,0,1,0,0,0,1
4691,i am a bit depressed really feeling defeated,sadness,0,0,0,0,1,0,0
970,i feel resigned to what i have brought myself to and docile,sadness,0,0,0,0,1,0,0
2058,i want is to be happy and to feel loved,love,0,0,0,1,0,0,1
13591,i feel stupid every time i even think about it,sadness,0,0,0,0,1,0,0
14922,i look down feeling alone and wantig to be that way,sadness,0,0,0,0,1,0,0
11487,i read i feel like ive just enjoyed a rich journey through the history of settling the american west as well as through the values faith fortitude hard work and joy so readily cherished then and hopefully now,joy,0,0,1,0,0,0,1
2134,i tried to answer as generally as i could but ive been struggling with my work lately and feeling pretty morose,sadness,0,0,0,0,1,0,0
1217,i feel quite pleased with these little bits of news so i will celebrate tonight with a meet the brewer event hawkshead with some of my members in one of my newest pubs,joy,0,0,1,0,0,0,1
14723,i will admit that some days i yell some days i dont want to get out of bed some days i cuss and freak out even some days i dont even really want to talk to anyone because i feel a little numb and im afraid people will know that im not ok,sadness,0,0,0,0,1,0,0
997,i chant the invocation and feel his force supporting me as i teach,joy,0,0,1,0,0,0,1
12889,i feel the need to emphasize these things at the moment because of how grumpy i have been this last week,anger,1,0,0,0,0,0,0
245,i feel stupid whenever this happens,sadness,0,0,0,0,1,0,0
277,i just feel like if i can just make it through this week it will be ok,joy,0,0,1,0,0,0,1
181,i will enclose her verses on her could not weigh much more thinking and feeling curious to hear the odd couple,surprise,0,0,0,0,0,1,1
15188,i know your feeling because i have it and i am glad you have it,joy,0,0,1,0,0,0,1
661,ill just run to people watch feel the wind in my face see the lovely colours of nature and look at the planes flying higher up in the distance,love,0,0,0,1,0,0,1
173,i have to admit i feel amused when i see the pti jamiat and a whole lot of others in the media try to avoid the suggestion that they are actually protesting the use of sharia in the case of raymond davis s release,joy,0,0,1,0,0,0,1
10788,i need when i feel beaten down,sadness,0,0,0,0,1,0,0
1517,i agree with that overall life philosophy but sometimes people and even kids need their negative emotions acknowledged so that they don t feel ignored and negated in what they are truly feeling,sadness,0,0,0,0,1,0,0
9869,i get the happy i can die now feeling and i honestly feel like if i died in the next few minutes i would be satisfied with life,joy,0,0,1,0,0,0,1
12663,i stumble upon such a finding i feel quite excited almost like having accomplished a discovery,joy,0,0,1,0,0,0,1
920,i feel agitated and empty and missing something,anger,1,0,0,0,0,0,0
9025,i feel excited just imagining it,joy,0,0,1,0,0,0,1
9653,i think she will have the luxury of looking back at her fashion moments and feel proud,joy,0,0,1,0,0,0,1
12743,i can t help but to feel amused after reading this article,joy,0,0,1,0,0,0,1
11825,im spending every day waiting to hear from you and feeling like an idiot for caring,love,0,0,0,1,0,0,1
1980,i smile people smile back and tell me they feel a little cheered up seeing me being jolly in the morning,joy,0,0,1,0,0,0,1
5584,i feel a little foolish for ever having left duluth,sadness,0,0,0,0,1,0,0
13752,i really love it when i walk into a home and just feel really welcomed,joy,0,0,1,0,0,0,1
1819,i feel so frustrated because i had a long weekday and i dont really have plenty of rest and right now he keeps on coming in the room,anger,1,0,0,0,0,0,0
9023,im slow about this but it does feel weird returning to a home without your mum anymore,fear,0,1,0,0,0,0,0
1090,i dont know what it is about me and sweets they make me feel bouncy and pleased with everything,joy,0,0,1,0,0,0,1
1510,i feel appalled that i took advantage of my old friend s kindness,anger,1,0,0,0,0,0,0
4595,i want change but i feel like im discouraged because im living so comfortably,sadness,0,0,0,0,1,0,0
10747,i find myself feeling agitated because of how what the kids are playing i ask myself did i play this way when i was little,fear,0,1,0,0,0,0,0
4341,i feel amused and kind of tired still in the morning i,joy,0,0,1,0,0,0,1
11442,im already feeling stressed about salvaging the friendship as time goes by i realize theres also another point that isnt helping,anger,1,0,0,0,0,0,0
9357,i wish i could say this led to me feeling socially accepted,joy,0,0,1,0,0,0,1
14188,i am feeling romantic on this beautiful summers day rel bookmark permalink,love,0,0,0,1,0,0,1
3703,i feel is only acceptable when that violence could lessen much more violence this could also apply to what i am discussing below i,joy,0,0,1,0,0,0,1
413,i really want to go buy some yardage of art gallery just to play with because it feels so amazing,surprise,0,0,0,0,0,1,1
9266,i slow a bit to stay with him partly because i am feeling like if i start to win he will just give up and partly because i am afraid that if i push it he will kill himself trying to stay with me,fear,0,1,0,0,0,0,0
8812,i do feel weird making an exact replica of someone else work,fear,0,1,0,0,0,0,0
4911,i just feel like weve been living in a weird time warp like its only wednesday,fear,0,1,0,0,0,0,0
